{
  "$schema": "https://json-schema.org/draft/2020-12/schema",
  "$id": "https://the-pass.dev/schemas/source_note.schema.json",
  "title": "SourceNote",
  "type": "object",
  "required": [
    "schema_version",
    "id",
    "type",
    "priority",
    "status",
    "claim",
    "evidence",
    "limitations",
    "market_applicability",
    "required_tests",
    "failure_modes",
    "system_requirements"
  ],
  "properties": {
    "schema_version": { "const": 1 },
    "id": { "type": "string", "minLength": 1 },
    "type": {
      "type": "string",
      "enum": ["academic", "book", "interview", "vendor-doc", "strategy-review", "blog", "code"]
    },
    "priority": { "type": "string", "enum": ["P0", "P1", "P2", "P3"] },
    "status": {
      "type": "string",
      "enum": ["unread", "skimmed", "reviewed", "implemented", "rejected"]
    },
    "url": { "type": "string" },
    "bibliography": { "type": "string" },
    "claim": { "type": "string", "minLength": 1 },
    "evidence": { "type": "string", "minLength": 1 },
    "limitations": { "type": "string", "minLength": 1 },
    "market_applicability": { "type": "array", "minItems": 1, "items": { "type": "string", "minLength": 1 } },
    "tradable_implication": { "type": "string" },
    "required_tests": { "type": "array", "minItems": 1, "items": { "type": "string", "minLength": 1 } },
    "failure_modes": { "type": "array", "minItems": 1, "items": { "type": "string", "minLength": 1 } },
    "system_requirements": { "type": "array", "minItems": 1, "items": { "type": "string", "minLength": 1 } },
    "notes_owner": { "type": "string" },
    "review_date": { "type": "string", "format": "date" }
  },
  "additionalProperties": true
}
